{
  "type": "logic_packet",
  "version": "v0",
  "id": "logic-packet-v0-omi-seed",
  "description": "Minimal reconstructive packet: rebuild the text OMI from one seed plus LUT deltas.",
  "preheader_commitment": [
    0,
    27,
    28,
    29,
    30,
    31
  ],
  "preheader_stream": [
    0,
    1,
    2,
    3,
    15,
    16,
    31,
    32,
    46,
    64
  ],
  "delta_law": {
    "id": "rotl1_xor_rotl3_xor_rotr2_xor_C",
    "width_bits": 8,
    "rotl": [
      1,
      3
    ],
    "rotr": [
      2
    ],
    "operator": "xor",
    "constant": 2,
    "mask": "0xff"
  },
  "origin": {
    "seed": 79,
    "label": "ASCII O"
  },
  "rule_lut": {
    "O->M": -2,
    "M->I": -4
  },
  "rewrite_program": [
    {
      "op": "emit_seed"
    },
    {
      "op": "lut_add_emit",
      "key": "O->M"
    },
    {
      "op": "lut_add_emit",
      "key": "M->I"
    }
  ],
  "projection": {
    "target": "text",
    "encoding": "utf8"
  },
  "expected": {
    "artifact_sha256": "9e28e57582c00755e1882b8ddbd081f967b63c1beb8a4c4d879127dc8736ce95",
    "artifact_text": "OMI",
    "preheader_witness_sha256": "9b5c1c829e04b3acf08cc69f4bf7c9b55b5ee2071f70402c5f51946ab5719978"
  },
  "repair_hints": [
    "If replay fails with E_MISSING_LUT_ENTRY, request only that LUT key from a peer.",
    "If replay fails with E_PREHEADER_REPLAY_FAILED, reject the packet before interpreting the rewrite program."
  ]
}
